{
  "title": "Газонные ограждения",
  "slug": "gazonnye-ograzhdeniya",
  "parentSectionSlug": "ograzhdeniya-i-zabory",
  "shortDescription": "Низкие ограждения для газонов, клумб, пешеходных зон и дворовых территорий.",
  "heroTitle": "Газонные ограждения",
  "heroDescription": "Изготавливаем низкие ограждения для газонов, клумб, пешеходных зон и элементов благоустройства.",
  "order": 6,
  "showInSectionGrid": true,
  "isActive": true,
  "image": "/uploads/chatgpt-image-may-28-2026-02-49-39-pm-1-6-1780248534908.png",
  "imageView": {
    "fit": "contain",
    "positionX": 50,
    "positionY": 58,
    "scale": 1.04
  },
  "placeholderLabel": "Рендер будет добавлен позже",
  "mode": "custom-list",
  "seoTitle": "Газонные ограждения под заказ",
  "seoDescription": "Газонные ограждения для клумб, дворов, пешеходных зон и благоустройства территорий.",
  "gallery": [
    {
      "src": "/uploads/chatgpt-image-may-28-2026-02-49-39-pm-3-4-1781365709642.png",
      "alt": "",
      "caption": ""
    },
    {
      "src": "/uploads/chatgpt-image-may-28-2026-02-49-39-pm-7-5-1781365709659.png",
      "alt": "",
      "caption": ""
    },
    {
      "src": "/uploads/chatgpt-image-may-28-2026-02-49-39-pm-9-5-1781365709666.png",
      "alt": "",
      "caption": ""
    },
    {
      "src": "/uploads/chatgpt-image-may-28-2026-02-49-39-pm-5-4-1781365709651.png",
      "alt": "",
      "caption": ""
    },
    {
      "src": "/uploads/chatgpt-image-may-28-2026-02-49-39-pm-1-6-1781365967246.png",
      "alt": "",
      "caption": ""
    },
    {
      "src": "/uploads/chatgpt-image-31-2026-18-02-34-1781365709607.png",
      "alt": "",
      "caption": ""
    },
    {
      "src": "/uploads/chatgpt-image-31-2026-18-02-20-1781365709569.png",
      "alt": "",
      "caption": ""
    },
    {
      "src": "/uploads/chatgpt-image-31-2026-18-02-27-1781365709586.png",
      "alt": "",
      "caption": ""
    },
    {
      "src": "/uploads/chatgpt-image-31-2026-18-02-38-1781365709624.png",
      "alt": "",
      "caption": ""
    },
    {
      "src": "/uploads/a135b4c3-e837-4170-bb37-414b63c29532-1781365929068.png",
      "alt": "",
      "caption": ""
    }
  ]
}
