{
  "title": "Качели",
  "slug": "kacheli",
  "parentSectionSlug": "ulichnaya-mebel",
  "shortDescription": "Краткое описание типа изделий.",
  "heroTitle": "Качели",
  "heroDescription": "Описание первого экрана.",
  "order": 7,
  "showInSectionGrid": true,
  "isActive": true,
  "image": "/uploads/chatgpt-image-17-2026-15-32-59-1779550274031.png",
  "placeholderLabel": "",
  "mode": "catalog-list",
  "seoTitle": "Качели",
  "seoDescription": "Описание страницы.",
  "imageView": {
    "fit": "contain",
    "positionX": 50,
    "positionY": 50,
    "scale": 1
  }
}
