{
  "title": "Столбики и болларды",
  "slug": "stolbiki-i-bollardy",
  "parentSectionSlug": "ograzhdeniya-i-zabory",
  "shortDescription": "Стационарные и съемные элементы для ограничения въезда и защиты пешеходных зон.",
  "heroTitle": "Столбики и болларды",
  "heroDescription": "Изготавливаем стационарные и съемные столбики для ограничения въезда, защиты тротуаров и организации движения.",
  "order": 8,
  "showInSectionGrid": true,
  "isActive": true,
  "image": "",
  "placeholderLabel": "Рендер будет добавлен позже",
  "mode": "custom-list",
  "seoTitle": "Столбики и болларды под заказ",
  "seoDescription": "Стационарные и съемные столбики, болларды и ограничители для благоустройства территорий."
}
