{
  "title": "Шезлонги",
  "slug": "shezlongi",
  "parentSectionSlug": "ulichnaya-mebel",
  "shortDescription": "Текст",
  "heroTitle": "Шезлонги",
  "heroDescription": "Описание первого экрана.",
  "order": 6,
  "showInSectionGrid": true,
  "isActive": true,
  "image": "/uploads/chatgpt-image-17-2026-15-37-11-6-1779549205502.png",
  "placeholderLabel": "",
  "mode": "catalog-list",
  "seoTitle": "Шезлонги",
  "seoDescription": "Описание страницы.",
  "imageView": {
    "fit": "contain",
    "positionX": 29.33960523888582,
    "positionY": 33.7797984762841,
    "scale": 1
  }
}
