{
  "title": "Велопарковки",
  "slug": "veloparkovki",
  "parentSectionSlug": "ulichnaya-mebel",
  "shortDescription": "Проектируем и изготавливаем велопарковки под реальную нагрузку, схему трафика и требования объекта.",
  "heroTitle": "Велопарковки",
  "heroDescription": "Для жилых, коммерческих и общественных объектов.",
  "order": 5,
  "showInSectionGrid": true,
  "isActive": true,
  "image": "/uploads/chatgpt-image-17-2026-15-36-29-2-1779543022697.png",
  "placeholderLabel": "",
  "mode": "catalog-list",
  "seoTitle": "Велопарковки — СМУ-1",
  "seoDescription": "Велопарковки для жилых, коммерческих и общественных объектов.",
  "imageView": {
    "fit": "contain",
    "positionX": 50,
    "positionY": 50,
    "scale": 1
  }
}
