{
  "title": "Лавочки и скамейки",
  "slug": "lavochki-i-skameyki",
  "parentSectionSlug": "ulichnaya-mebel",
  "shortDescription": "Типовые и полутиповые решения с подбором длины, опор и покрытия под условия объекта.",
  "heroTitle": "Лавочки и скамейки",
  "heroDescription": "Для парков, дворов и коммерческих объектов.",
  "order": 1,
  "showInSectionGrid": true,
  "isActive": true,
  "image": "/uploads/1-1777627157241.png",
  "placeholderLabel": "Фото категории будет добавлено позже",
  "mode": "catalog-list",
  "seoTitle": "Лавочки и скамейки — СМУ-1",
  "seoDescription": "Лавочки и скамейки для парков, дворов и коммерческих объектов.",
  "imageView": {
    "fit": "contain",
    "positionX": 11.537939459752952,
    "positionY": 83.9652781963952,
    "scale": 1.06
  }
}
