{
  "title": "Беседки и перголы",
  "slug": "besedki-i-pergoly",
  "parentSectionSlug": "ulichnaya-mebel",
  "shortDescription": "Подбираем формат изделий для рекреационных зон, дворов и коммерческих пространств с учетом сценариев использования.",
  "heroTitle": "Беседки и перголы для зон отдыха",
  "heroDescription": "Подбираем формат изделий для рекреационных зон, дворов и коммерческих пространств с учетом сценариев использования.",
  "order": 8,
  "showInSectionGrid": true,
  "isActive": true,
  "image": "/uploads/chatgpt-image-23-2026-11-05-15-1779552133725.png",
  "placeholderLabel": "",
  "mode": "catalog-list",
  "seoTitle": "Беседки и перголы — СМУ-1",
  "seoDescription": "Беседки и перголы для зон отдыха, дворов и коммерческих пространств.",
  "imageView": {
    "fit": "contain",
    "positionX": 50,
    "positionY": 50,
    "scale": 1
  }
}
