{
  "title": "Уличное освещение",
  "slug": "ulichnoe-osveshchenie",
  "parentSectionSlug": "ulichnaya-mebel",
  "shortDescription": "Краткое описание типа изделий.",
  "heroTitle": "Уличное освещение",
  "heroDescription": "Описание первого экрана.",
  "order": 19,
  "showInSectionGrid": true,
  "isActive": true,
  "image": "/uploads/chatgpt-image-17-2026-15-33-36-1779554302618.png",
  "placeholderLabel": "",
  "mode": "catalog-list",
  "seoTitle": "Уличное освещение",
  "seoDescription": "Описание страницы.",
  "imageView": {
    "fit": "contain",
    "positionX": 50,
    "positionY": 50,
    "scale": 1
  }
}
