{
  "title": "Беседки и перголы",
  "slug": "kachali-shezlongi-pergoly",
  "parentSectionSlug": "ulichnaya-mebel",
  "shortDescription": "Подбираем формат изделий для рекреационных зон, дворов и коммерческих пространств с учетом сценариев использования.",
  "heroTitle": "Качели, шезлонги и перголы для зон отдыха",
  "heroDescription": "Подбираем формат изделий для рекреационных зон, дворов и коммерческих пространств с учетом сценариев использования.",
  "order": 5,
  "showInSectionGrid": true,
  "isActive": true,
  "image": "/assets/images/placeholders/street-furniture.svg",
  "placeholderLabel": "Фото будут обновлены в мае: материалы по категории.",
  "mode": "catalog-list",
  "seoTitle": "Качели, шезлонги, перголы — СМУ-1",
  "seoDescription": "Качели, шезлонги и перголы для зон отдыха."
}
