{
  "title": "Секционные ограждения",
  "slug": "sekcionnye-ograzhdeniya",
  "parentSectionSlug": "ograzhdeniya-i-zabory",
  "shortDescription": "Модульные секции для дворов, общественных пространств и территорий предприятий.",
  "heroTitle": "Секционные ограждения",
  "heroDescription": "Изготавливаем секционные ограждения для дворов, общественных пространств, коммерческих и производственных территорий.",
  "order": 4,
  "showInSectionGrid": true,
  "isActive": true,
  "image": "/uploads/chatgpt-image-31-2026-19-45-02-1780248513639.png",
  "imageView": {
    "fit": "contain",
    "positionX": 50,
    "positionY": 50,
    "scale": 1.04
  },
  "placeholderLabel": "Рендер будет добавлен позже",
  "mode": "custom-list",
  "seoTitle": "Секционные ограждения под заказ",
  "seoDescription": "Модульные секционные ограждения для благоустройства, дворов и территорий предприятий.",
  "gallery": [
    {
      "src": "/uploads/chatgpt-image-31-2026-19-45-02-1781365692951.png",
      "alt": "",
      "caption": ""
    },
    {
      "src": "/uploads/chatgpt-image-31-2026-19-43-54-1781365917276.png",
      "alt": "",
      "caption": ""
    }
  ]
}
