{
  "title": "Декоративные ограждения",
  "slug": "dekorativnye-ograzhdeniya",
  "parentSectionSlug": "ograzhdeniya-i-zabory",
  "shortDescription": "Ограждения с акцентом на внешний вид для входных зон, парков, дворов и благоустройства.",
  "heroTitle": "Декоративные ограждения",
  "heroDescription": "Изготавливаем декоративные ограждения для входных зон, дворов, парков и общественных пространств.",
  "order": 5,
  "showInSectionGrid": true,
  "isActive": true,
  "image": "",
  "placeholderLabel": "Рендер будет добавлен позже",
  "mode": "custom-list",
  "seoTitle": "Декоративные ограждения под заказ",
  "seoDescription": "Декоративные ограждения для входных зон, парков, дворов и общественных пространств."
}
