{
  "title": "Урны",
  "slug": "urny",
  "parentSectionSlug": "ulichnaya-mebel",
  "shortDescription": "Урны с учетом трафика, условий эксплуатации и требований по обслуживанию.",
  "heroTitle": "Урны",
  "heroDescription": "Для общественных пространств и коммерческих территорий.",
  "order": 3,
  "showInSectionGrid": true,
  "isActive": true,
  "image": "/uploads/chatgpt-image-17-2026-15-37-11-2-1779040041432.png",
  "placeholderLabel": "",
  "mode": "catalog-list",
  "seoTitle": "Урны — СМУ-1",
  "seoDescription": "Урны для общественных пространств и коммерческих территорий.",
  "imageView": {
    "fit": "contain",
    "positionX": 50,
    "positionY": 50,
    "scale": 1
  }
}
