{
  "title": "Столы и комплекты",
  "slug": "stoly-i-komplekty",
  "parentSectionSlug": "ulichnaya-mebel",
  "shortDescription": "Краткое описание типа изделий.",
  "heroTitle": "Столы и комплекты",
  "heroDescription": "Описание первого экрана.",
  "order": 2,
  "showInSectionGrid": true,
  "isActive": true,
  "image": "/uploads/chatgpt-image-23-2026-11-05-09-1779535974383.png",
  "placeholderLabel": "",
  "mode": "catalog-list",
  "seoTitle": "Столы и комплекты",
  "seoDescription": "Описание страницы.",
  "imageView": {
    "fit": "contain",
    "positionX": 50,
    "positionY": 60,
    "scale": 1
  }
}
