{
  "title": "Калитки",
  "slug": "kalitki",
  "parentSectionSlug": "ograzhdeniya-i-zabory",
  "shortDescription": "Калитки в едином стиле с забором, воротами или входной группой.",
  "heroTitle": "Калитки под заказ",
  "heroDescription": "Изготавливаем калитки под размеры проема, стиль ограждения и требования к эксплуатации.",
  "order": 3,
  "showInSectionGrid": true,
  "isActive": true,
  "image": "/uploads/chatgpt-image-31-2026-18-17-16-1780248503511.png",
  "imageView": {
    "fit": "contain",
    "positionX": 50,
    "positionY": 50,
    "scale": 1.05
  },
  "placeholderLabel": "Рендер будет добавлен позже",
  "mode": "custom-list",
  "seoTitle": "Калитки под заказ",
  "seoDescription": "Калитки в едином стиле с забором, воротами и входными группами.",
  "gallery": [
    {
      "src": "/uploads/chatgpt-image-31-2026-18-17-16-1781365674685.png",
      "alt": "",
      "caption": ""
    },
    {
      "src": "/uploads/chatgpt-image-31-2026-18-17-20-1781365674696.png",
      "alt": "",
      "caption": ""
    },
    {
      "src": "/uploads/chatgpt-image-31-2026-18-17-25-1781365674705.png",
      "alt": "",
      "caption": ""
    },
    {
      "src": "/uploads/chatgpt-image-31-2026-18-17-31-1781365674718.png",
      "alt": "",
      "caption": ""
    },
    {
      "src": "/uploads/chatgpt-image-31-2026-18-17-11-1781365890308.png",
      "alt": "",
      "caption": ""
    }
  ]
}
