{
  "title": "Перила и поручни",
  "slug": "perila-i-poruchni",
  "parentSectionSlug": "ograzhdeniya-i-zabory",
  "shortDescription": "Ограждения лестниц, пандусов, входных групп и перепадов высоты.",
  "heroTitle": "Перила и поручни",
  "heroDescription": "Изготавливаем перила и поручни для лестниц, пандусов, входных групп и зон с перепадами высоты.",
  "order": 7,
  "showInSectionGrid": true,
  "isActive": true,
  "image": "/uploads/chatgpt-image-31-2026-18-03-29-1780248547259.png",
  "imageView": {
    "fit": "cover",
    "positionX": 50,
    "positionY": 52,
    "scale": 1
  },
  "placeholderLabel": "Рендер будет добавлен позже",
  "mode": "custom-list",
  "seoTitle": "Перила и поручни под заказ",
  "seoDescription": "Перила, поручни и ограждения лестниц, пандусов и входных групп под размеры объекта."
}
