{
  "title": "Ограждения контейнерных площадок",
  "slug": "ograzhdeniya-kontejnernyh-ploshchadok",
  "parentSectionSlug": "ograzhdeniya-i-zabory",
  "shortDescription": "Секции, ворота и закрывающие элементы для площадок ТКО.",
  "heroTitle": "Ограждения контейнерных площадок",
  "heroDescription": "Изготавливаем ограждающие секции, ворота и закрывающие элементы для площадок ТКО под размеры и условия объекта.",
  "order": 9,
  "showInSectionGrid": true,
  "isActive": true,
  "image": "/uploads/chatgpt-image-31-2026-18-03-46-1780248556068.png",
  "imageView": {
    "fit": "contain",
    "positionX": 50,
    "positionY": 50,
    "scale": 1.03
  },
  "placeholderLabel": "Рендер будет добавлен позже",
  "mode": "custom-list",
  "seoTitle": "Ограждения контейнерных площадок",
  "seoDescription": "Ограждающие секции, ворота и элементы для контейнерных площадок ТКО под размеры объекта.",
  "gallery": [
    {
      "src": "/uploads/chatgpt-image-31-2026-18-03-54-1781365784765.png",
      "alt": "",
      "caption": ""
    },
    {
      "src": "/uploads/chatgpt-image-31-2026-18-03-46-1781365991446.png",
      "alt": "",
      "caption": ""
    }
  ]
}
