{
  "title": "Навесы",
  "slug": "navesy",
  "parentSectionSlug": "ulichnaya-mebel",
  "shortDescription": "Навесы и козырьки для входных групп и открытых площадок.",
  "heroTitle": "Навесы",
  "heroDescription": "Навесы для входных групп, зон отдыха и открытых площадок. Выберите модель или обсудите конструкцию под размеры объекта.",
  "order": 39,
  "showInSectionGrid": true,
  "isActive": true,
  "image": "/uploads/chatgpt-image-17-2026-15-36-16-1779555093886.png",
  "placeholderLabel": "",
  "mode": "catalog-list",
  "seoTitle": "Навесы",
  "seoDescription": "Описание страницы.",
  "imageView": {
    "fit": "cover",
    "positionX": 50,
    "positionY": 50,
    "scale": 1
  }
}
