{
  "title": "Ворота",
  "slug": "vorota",
  "parentSectionSlug": "ograzhdeniya-i-zabory",
  "shortDescription": "Распашные и откатные решения под проем, забор и условия эксплуатации.",
  "heroTitle": "Ворота под заказ",
  "heroDescription": "Изготавливаем ворота под проем, конструкцию ограждения, тип открывания и условия эксплуатации.",
  "order": 2,
  "showInSectionGrid": true,
  "isActive": true,
  "image": "/uploads/chatgpt-image-31-2026-18-07-49-1780248482346.png",
  "imageView": {
    "fit": "contain",
    "positionX": 50,
    "positionY": 50,
    "scale": 1.04
  },
  "placeholderLabel": "Рендер будет добавлен позже",
  "mode": "custom-list",
  "seoTitle": "Ворота под заказ",
  "seoDescription": "Распашные и откатные ворота под размеры проема и требования объекта.",
  "gallery": [
    {
      "src": "/uploads/chatgpt-image-31-2026-18-07-55-1781365659264.png",
      "alt": "",
      "caption": ""
    },
    {
      "src": "/uploads/chatgpt-image-31-2026-18-07-49-1781365869205.png",
      "alt": "",
      "caption": ""
    }
  ]
}
