{
  "title": "Малые элементы",
  "slug": "malye-elementy",
  "parentSectionSlug": "ulichnaya-mebel",
  "shortDescription": "Краткое описание типа изделий.",
  "heroTitle": "Малые элементы",
  "heroDescription": "Описание первого экрана.",
  "order": 29,
  "showInSectionGrid": true,
  "isActive": true,
  "image": "/uploads/chatgpt-image-17-2026-15-37-11-9-1779554402933.png",
  "placeholderLabel": "",
  "mode": "catalog-list",
  "seoTitle": "Малые элементы",
  "seoDescription": "Описание страницы.",
  "imageView": {
    "fit": "contain",
    "positionX": 50,
    "positionY": 50,
    "scale": 1
  }
}
