{
  "title": "Вазоны и цветочницы",
  "slug": "vazony-i-tsvetochnitsy",
  "parentSectionSlug": "ulichnaya-mebel",
  "shortDescription": "Изготавливаем уличные вазоны под сезонное и круглогодичное озеленение с учетом условий эксплуатации.",
  "heroTitle": "Вазоны и цветочницы",
  "heroDescription": "Для общественных и коммерческих территорий.",
  "order": 4,
  "showInSectionGrid": true,
  "isActive": true,
  "image": "/uploads/chatgpt-image-17-2026-15-36-52-3-1779539053176.png",
  "placeholderLabel": "",
  "mode": "catalog-list",
  "seoTitle": "Вазоны и цветочницы — СМУ-1",
  "seoDescription": "Вазоны и цветочницы для общественных и коммерческих территорий.",
  "imageView": {
    "fit": "contain",
    "positionX": 29,
    "positionY": 50,
    "scale": 1
  }
}
